Variable Names,English,Spanish,Portuguese (Brazilian),Vietnamese,French,Korean,Amharic,Burmese,Arabic,Mandarin Chinese
insurance_card_photo_id,May I have the insurance card and Photo Id?,¿Me permite la tarjeta del seguro y una identificación con foto?,Posso ver o cartão do plano de saúde e um documento de identidade com foto?,Vui lòng cho tôi xem thẻ bảo hiểm và giấy tờ nhận dạng có ảnh được không?,Puis-je avoir la carte d'assurance et la carte d'identité avec photo ?,보험 카드와 사진이 있는 신분증을 보여 주시겠습니까?,የመድህን ካርድ እና የፎቶ መታወቂያ ሊሰጡኝ ይችላሉ?,အာမခံကတ်ပြား ဒါမှမဟုတ် ဓါတ်ပုံပါ သက်သေခံကတ်ပြား ပေးပါ။,هل يمكنني الحصول على بطاقة التأمين وهوية تحمل صورة؟,能不能把保险卡和带照片的身份证给我一下？
confirming_information,Now I'm going to confirm some information with you.,Ahora voy a confirmar con usted la información.,Vou confirmar algumas informações com você.,Bây giờ tôi sẽ xác nhận một số thông tin với quý vị.,Je vais maintenant vous demander de confirmer certaines informations.,이제 몇 가지 정보를 확인하겠습니다.,አሁን ከእርስዎ የተወሰነ መረጃ አረጋግጣለሁ።,အခု မေးခွန်းအချို့ မေးပါမယ်။,سوف أؤكد الآن بعض المعلومات معك.,现在我需要跟您确认一下相关信息。
patients_address,What is the patient's address?,¿Cuál es la dirección del paciente?,Qual é o endereço do paciente?,Địa chỉ của bệnh nhân là gì?,Quelle est l'adresse du patient ou de la patiente?,환자 주소가 어떻게 됩니까?,የታካሚው አድራሻ የት ነው?,လူနာရဲ့ လိပ်စာ ဘာလဲ။,ما عنوان المريض؟,患者的地址是什么？
primary_contact_phone,What is the primary contact telephone number for the patient? Is this mom or dad's number?,¿Cuál es el teléfono principal de contacto que se usará con relación al paciente? ¿Es el número de la mamá o del papá?,Qual é o telefone de contato principal do paciente? Esse é o número da mãe ou do pai?,Số điện thoại chính để liên lạc về bệnh nhân là gì? Đây là số của cha hay mẹ?,Quel est le numéro de téléphone principal de la personne à contacter pour le patient ou la patiente? S'agit-il du numéro de la mère ou du père ?,환자의 기본 연락 전화번호는 무엇입니까? 이 번호는 어머님 아니면 아버님 번호입니까?,የታካሚው ዋና የመገኛ ስልክ ቁጥር ምንድን ነው? ይህ የእናት ወይም የአባት ቁጥር ነው?,လူနာကို ဆက်သွယ်ရမယ့် ဖုန်းနံပါတ် ဘာလဲ။ အမေရဲ့ ဖုန်းနံပါတ်လား ဒါမှမဟုတ် အဖေရဲ့ ဖုန်းနံပါတ်လား။,ما رقم هاتف الاتصال الرئيس للمريض؟ هل هذا رقم الأم أم الأب؟,患者的主要联系电话号码是多少？这是妈妈还是爸爸的号码？
insurance_through_mom_dad,Is the insurance through mom or dad?,¿Tiene el seguro a través de su mamá o de su papá?,O plano de saúde está no nome da mãe ou do pai?,Bảo hiểm là qua cha hay mẹ?,L'assurance est-elle souscrite au nom du père ou de la mère ?,어머님 보험 아니면 아버님 보험을 통해서 하실 건가요?,መድህኑ በእናት ወይም በአባት በኩል ነው?,အာမခံက အဖေနာမည်နဲ့လုပ်တာလား ဒါမှမဟုတ် အမေနာမည်နဲ့လုပ်တာလား။,هل التأمين عن طريق الأم أم الأب؟,保险投保人是妈妈还是爸爸？
who_do_they_work_for,Who do they work for?,¿Para quién trabaja?,Para quem o titular do plano trabalha?,Cha hay mẹ làm việc cho ai?,Où travaille cette personne?,어디에서 일하십니까?,እነርሱ የሚሰሩት ለማን ነው?,သူတို့ ဘယ်မှာအလုပ်လုပ်သလဲ။,أين يعملون؟,他们的工作单位是什么？
primary_care_provider,Who is the patient's Primary Care Provider?,¿Quién es el médico de atención primaria del paciente?,Quem é o provedor de cuidados primários do paciente?,Bác sĩ gia đình của bệnh nhân là ai?,Qui est le prestataire de soins primaires du patient ou de la patiente ?,환자분의 1차 진료 제공자는 누구입니까?,የታካሚው ዋና የእንክብካቤ አቅራቢ ማን ነው?,လူနာကို အဓိက စောင့်ရှောက်ပေးတာ ဘယ်သူလဲ။,من مُقدم خدمة الرعاية الأولية للمريض؟,患者的家庭医生是谁？
referred_by,Who referred you to us?,¿Quién lo refirió a nosotros?,Quem encaminhou o paciente para nós?,Ai đã giới thiệu quý vị đến với chúng tôi?,Qui vous a adressé à nous?,귀하를 저희에게 의뢰하신 분이 누구입니까?,ወደ እኛ የጠቆምዎት ማን ነው?,ဒီကို ဘယ်သူက ညွှန်းလိုက်သလဲ။,من أحالك إلينا؟,谁向您推荐了我们？
which_pharmacy,What pharmacy do you use if any medication is ordered? (verify location of pharmacy),¿Qué farmacia prefiere en caso de que tengamos que prescribir algún medicamento? (verifique la ubicación de la farmacia),Qual farmácia você usa se precisar de algum medicamento? (verifique a localização da farmácia),Quý vị sử dụng nhà thuốc nào nếu bác sĩ có cho thuốc theo toa? (kiểm tra xác nhận địa điểm của nhà thuốc),Quelle pharmacie utilisez-vous en cas de besoin de médicaments? (vérifiez les coordonnées de la pharmacie),어느 약국에서 약을 주문하십니까? (약국 위치 확인),ማንኛውም መድሃኒት ቢታዘዝ የሚጠቀሙት የመድሃኒት መደብር የትኛው ነው? (የመድሃኒት መደብሩን መገኛ ስፍራ ያረጋግጡ),​ဆေးဝယ်ဖို့ဆေးစာပေးရင် ဘယ်ဆေးဆိုင်မှာ ဝယ်သလဲ။ (ဆေးဆိုင်နေရာပြောပါ),ما الصيدلية التي تطلبين منها أي دواء؟ (التحقق من موقع الصيدلية),如果需要购买药物 您会选择哪家药房？（核实药房地址）
consent_to_treat_form,This form is Consent to Treat and to fill the insurance. Please fill it out.,Este formulario es el consentimiento para recibir tratamiento y para el seguro. Es necesario que lo llene.,Este formulário é o Consentimento para Tratamento e para o preenchimento do plano de saúde. Preencha o formulário por favor.,Mẫu đơn này là Chấp thuận cho phép điều trị và điền thông tin bảo hiểm. Vui lòng điền mẫu đơn. ,Ce formulaire est un consentement au traitement et à la prise en charge par l'assurance. Veuillez le remplir.,이 양식은 치료 동의 및 보험 사항 기입에 대한 것입니다. 기재해 주십시오.,ይህ ቅጽ የህክምና ፈቃድ እና መድህኑን የመሙላት ስምምነት ነው። እባክዎ ይሙሉ።,ဒီပုံစံက ကုသဖို့ သဘောတူချက်ပေးတာနဲ့ အာမခံအတွက်ဖြည့်ဖို့ဖြစ်ပါတယ်။ ပုံစံကိုဖြည့်ပေးပါ။,هذا نموذج الموافقة على العلاج واستكمال بيانات التأمين. يُرجى استكماله.,此表格为同意治疗书，需要填写保险信息。请填写该表格。
form_for_mychart,This form is to sign you and your child up for MyChart for access to all records.,Este formulario es para registrarlos a usted y a su niño en MyChart para que tengan acceso a todos los registros.,Este formulário é para inscrever você e a criança no MyChart que dá acesso à toda documentação médica.,Mẫu này để đăng ký cho quý vị và em bé vào hồ sơ điện tử MyChart để được xem tất cả các hồ sơ.,Ce formulaire sert à vous inscrire vous et votre enfant à MyChart pour vous permettre d'avoir accès à tous les dossiers.,이 양식은 귀하와 귀하의 자녀가 모든 기록에 접근할 수 있도록 MyChart에 등록하기 위해 필요합니다.,ይህ ቅጽ ሁሉንም መዝገቦች ማግኘት እንዲችሉ እርስዎን እና ልጅዎን ለ MyChart ይመዘግቦታል።,ဒီပုံစံက သင်နဲ့သင့်ကလေးအတွက် ဆေးမှတ်တမ်းအားလုံးကို ဝင်ကြည့်ဖို့အတွက် MyChart မှာစာရင်းသွင်းပေးတာပါ။,هذا النموذج لتسجيلك أنت وطفلك في تطبيق MyChart للوصول إلى جميع السجلات.,此表格用于为您和您的孩子注册 MyChart 以便访问所有记录。
email_in_24_hours,You will receive email notification within 24 hours.,Recibirá la notificación por correo electrónico dentro de 24 horas.,Você vai receber um aviso por e-mail dentro de 24 horas.,Quý vị sẽ nhận được email thông báo trong vòng 24 giờ.,Vous recevrez une notification par courrier électronique dans les 24 heures.,귀하에게 24시간 이내 이메일 알림이 갈 것입니다.,በ 24 ሰዓታት ውስጥ የኢሜይል ማሳወቂያ ይደርስዎታል።,သင် ၂၄ နာရီအတွင်း အီးမေးလ်နဲ့ပြန်စာ ရပါလိမ့်မယ်။,سوف تتلقى إشعارًا عبر البريد الإلكتروني خلال 24 ساعة.,您将在 24 小时内收到电子邮件通知。
thank_you_waiting_room,Thank you. You may have a seat in the waiting room. Someone will call you back shortly.,Gracias. Puede tomar asiento en la sala de espera. Alguien lo llamará muy pronto.,Agradeço. Pode se sentar na sala de espera. Alguém vai chamar você em breve.,Cám ơn quý vị.  Quý vị có thể ngồi trong phòng chờ. Sẽ có người gọi quý vị vào ngay.,Nous vous remercions. Vous pouvez vous asseoir dans la salle d'attente. Quelqu'un vous appellera sous peu.,감사합니다. 대기실에 앉아 계십시오. 다른 사람이 곧 호명할 것입니다.,እናመሰግናለን። የጥበቃ ክፍል ውስጥ መቀመጥ ይችላሉ። በአጭር ጊዜ ውስጥ ይደወልልዎታል።,​ကျေးဇူးတင်ပါတယ်။ စောင့်ဆိုင်းအခန်းမှာ ထိုင်နိုင်ပါပြီ။ တစ်ယောက်ယောက်က မကြာခင် ပြန်ခေါ်ပါလိမ့်မယ်။,شكرًا لك. يمكنك التفضل بالجلوس في غرفة الانتظار. سوف نطلبك بعد قليل.,谢谢。您可以在候诊室等待。很快会有人叫您回来。
doctor_is_running_behind,I apologize but the doctor is running behind and the wait may be a little longer than expected.,Nos disculpamos pero el doctor está atrasado y pudiera ser necesario que espere un poco más de lo que se había anticipado.,Desculpa mas o médico está atrasado e o tempo espera pode ser um pouco mais longo do que o esperado.,Tôi xin lỗi nhưng bác sĩ đang bị dồn việc nên thời gian chờ đợi có thể lâu hơn dự tính ​​một chút.,Je vous prie de m'excuser mais le médecin a pris du retard et l'attente risque d'être un peu plus longue que prévu.,죄송하지만 의사 진료가 밀려서 조금 더 기다리셔야 할 것 같습니다.,ይቅርታነገር ግን ሐኪሙ አርፍዷል ስለሆነም ከሚጠበቀው ጊዜ በላይ ሊጠብቁ ይችላሉ።,စိတ်မရှိပါနဲ့၊ ဆရာဝန် နည်းနည်းနောက်ကျနေပါတယ်၊ စောင့်ဆိုင်းရတာ ခန့်မှန်းထားတာထက် နည်းနည်း ပိုကြာနိုင်ပါတယ်။,أعتذر ولكن الطبيب يتأخر وقد يكون الانتظار أطول قليلاً من المتوقع.,很抱歉，医生现在很忙，您等待的时间可能会比预期时间要长一些。
want_bottle_of_water,Would you like a bottle of water?,¿Desea una botella de agua?,Quer uma garrafinha de água?,Quý vị có cần uống nước không?,Voulez-vous une bouteille d'eau?,물 한 병 드릴까요?,አንድ ጠርሙስ ውሃ ይፈልጋሉ?,​ရေပုလင်း လိုချင်ပါသလား။,هل ترغب في الحصول على زجاجة ماء؟,您是否想要一瓶水？
lets_schedule_follow_up,Let's get you scheduled for your follow up appointment.,Vamos a programar su cita de seguimento.,Vamos agendar a consulta de acompanhamento.,Chúng ta hãy cùng lấy hẹn tái khám cho em bé.,Prenons rendez-vous pour votre consultation de suivi.,추후 진료 일정을 잡아드리겠습니다.,ለክትትል ቀጠሮዎ መርሃግብር እንያዝልዎት።,​နောက်ဆက်တွဲ ရက်ချိန်းအတွက် ရက်ချိန်းပေးပါမယ်။,دعنا نحدد لك موعد المتابعة.,让我们为您安排复诊。
have_a_great_day,Have a great day!,¡Que pase un buen día!,Tenha um ótimo dia!,Chúc quý vị một ngày an lành!,Je vous souhaite une excellente journée !,좋은 하루되십시오!,መልካም ቀን ይሁንልዎ!,အကောင်းဆုံးနေ့ ဖြစ်ပါစေ။,أتمنى لك قضاء يوم رائع!,祝您愉快！
doctor_will_see_you_unsure_about_wait_time,The doctor will be able to see you later now. We are not sure how long the wait time will be.,El médico lo recibirá hoy mismo un poco más tarde. No estamos seguros de cuál será el tiempo de espera.,O médico pode atender você mais tarde. Não sabemos ao certo qual será o tempo de espera.,Bây giờ bác sĩ sẽ có thể gặp quý vị sau. Chúng tôi không chắc thời gian chờ đợi sẽ kéo dài bao lâu.,Le médecin pourra vous recevoir plus tard. Nous ne sommes pas sûrs de la durée de l'attente.,조금 후에 의사와 만나실 수 있습니다. 얼마나 기다리셔야 할지는 잘 모르겠습니다.,ሐኪሙወደ በኋላ እርስዎን ማየት ይችላል። የጥበቃ ጊዜው ምን ያክል ሊሆን እንደሚችል አናውቅም።,ဆရာဝန် ခဏကြာရင် ကြည့်ပေးနိုင်ပါတယ်။ ဘယ်လောက်ကြာကြာစောင့်ရမယ်ဆိုတာတော့ မသိပါဘူး။,سيكون الطبيب قادرًا على رؤيتك لاحقًا الآن. لسنا متأكدين من مدة الانتظار.,医生稍后就可以为您看诊。我们不确定候诊时间要多久。
im_sorry_but_reschedule,I'm sorry but we will have to reschedule you for another day.,Lo lamentamos mucho pero tenemos que reprogramar su cita para otro día.,Sinto muito mas temos que remarcar a consulta para outro dia.,Rất tiếc là chúng tôi sẽ phải dời hẹn của quý vị vào một ngày khác.,Je suis désolé(e) mais nous allons devoir vous fixer un autre rendez-vous.,죄송하지만 다른 날로 일정을 잡아 드리겠습니다.,ይቅርታ  ነገር ግን የእርስዎን ቀጠሮ ወደ ሌላ ቀን መቀየር ይኖርብናል።,စိတ်မကောင်းပါဘူး၊ နောက်တစ်နေ့ကို ပြန်ချိန်းပေးပါမယ်။,أنا آسف ولكن سيتعين علينا إعادة جدولة موعدك ليوم آخر.,很抱歉，我们只能为您安排下次就诊。
what_time_works_for_you,What time works best for you? Morning? Afternoon?,¿Qué hora le parece mejor? ¿En la mañana? ¿En la tarde?,Qual é o melhor horário para você? De dia? À tarde?,Thời gian nào thuận tiện nhất cho quý vị? Buổi sáng?  Buổi chiều?,Quelle heure vous convient le mieux? Le matin? L'après-midi?,언제가 가장 편하십니까? 오전? 오후?,ለእርስዎ የሚመችዎ ስንት ሰዓት ነው? ጠዋት? ከሰዓት በኋላ?,သင့်အဖို့ ဘယ်အချိန် အဆင်အပြေဆုံးလဲ။ မနက်ပိုင်းလား။ နေ့လည်ပိုင်းလား။,ما الوقت المناسب لك؟ صباحًا؟ بعد الظهر؟,什么时间对您来说最方便？上午？还是下午？
form_for_parent_conversation,This form allows us to talk to your parents since you are an adult. Please fill out the highlighted areas.,Este formulario nos permite hablar con sus padres ya que es un adulto. Llene todas las áreas resaltadas.,Este formulário nos permite falar com o seu pai ou e a sua mãe já que você é maior de idade. Preencha as áreas destacadas por favor.,Mẫu đơn này cho phép chúng tôi nói chuyện với cha mẹ của quý vị vì quý vị đã trưởng thành. Vui lòng điền các phần được đánh dấu.,Ce formulaire nous permet de parler à vos parents puisque vous êtes adulte. Veuillez remplir les zones surlignées.,귀하가 성인이기에 이 양식을 작성하실 경우 저희가 귀하의 부모님과 대화할 수 있습니다. 하이라이트된 부분을 기재해 주십시오.,ይህ ቅጽ እርስዎ አዋቂ ስለሆኑ ወላጆችዎን እንድናነጋግር ያስችለናል። የቀለሙትን ቦታዎች እባክዎ ይሙሉ።,သင် အရွယ်ရောက်သူ မဟုတ်တဲ့အတွက် ဒီပုံစံကြောင့် ကျွန်ုပ်တို့ သင့်မိဘများနဲ့ စကားပြောနိင်မှာဖြစ်ပါတယ်။ အရောင်ခြယ်ထားတဲ့ အပိုင်းတွေကို ဖြည့်စွက်ပေးပါ။,يتيح لنا هذا النموذج التحدث مع والديك نظرًا لأنك بالغ. يُرجى استكمال المناطق المميزة.,由于您已经成年，此表让我们能够与您的父母进行交流。请填写高亮显示的区域。
stand_on_scale_for_height_weight,Please stand on the scale to measure height and weight.,Súbase a la balanza para tomar su peso y altura.,Suba na balança para medir a altura e o peso.,Vui lòng đứng lên cân để đo chiều cao và trọng lượng.,Veuillez monter sur la balance pour que je puisse mesurer votre taille et votre poids.,키와 몸무게를 잴 수 있게 체중계에 올라서십시오.,ቁመት እና ክብደት ለመለካት እባክዎ ሚዛኑ ላይ ይቁሙ።,အရပ်နဲ့ကိုယ်အလေးချိန် တိုင်းဖို့ ပေါင်ချိန်စက်ပေါ် တက်ပါ။,يُرجى الوقوف على الميزان لقياس الطول والوزن.,请站在体重秤上测量身高和体重。
baby_on_scale,Please lay the baby on the scale to check their weight.,Coloque al bebé en la balanza para pesarlo.,Coloque o bebê na balança para verificar o peso.,Vui lòng đặt em bé lên bàn cân để đo trọng lượng.,Posez votre bébé sur la balance pour que je puisse vérifier son poids.,아기의 몸무게를 확인할 수 있도록 아기를 체중계 위에 올려놓으십시오.,የህጻኑን ክብደት ለመለካት እባክዎ ህጻኑን ሚዛኑ ላይ ያስቀምጡ።,ကလေးကိုယ်အလေးချိန်တိုင်းဖို့ ကလေးကို ပေါင်ချိန်စက်ပေါ်တင်ပါ။,يُرجى وضع الطفل على الميزان للتحقق من وزنه.,请将婴儿放在体重秤上测量体重。
remove_top_and_put_on_vest,Please remove your top and put on this vest open in the front.,Quítese la camisa y póngase la bata con la parte abierta hacia el frente.,Retire a blusa e vista este colete aberto na frente.,Vui lòng cởi áo và mặc chiếc áo nhỏ này phần mở ở phía trước.,Veuillez enlever votre haut et enfiler ce vêtement ouvert sur le devant.,상의를 벗고 앞부분이 열린 조끼를 입으십시오.,እባክዎ ከላይ የለበሱትን በማውለቅ ይህን ሰደርያ ከፊት ክፍት በማድረግ ይልበሱ።,အပေါ်အင်္ကျီကိုချွတ်ပြီး ဒီဝတ်ရုံကို အရှေ့ဘက်ဖွင့်ပြီးဝတ်ပါ။,يُرجى خلع القميص وارتداء هذه السترة المفتوحة من الأمام.,请脱掉上衣，穿上这件前开襟背心。
checking_pulse,I am placing this on the finger to check the pulse ox.,Le estoy poniendo esto en el dedo para medir su oximetría de pulso.,Estou colocando isto no dedo para verificar a oximetria de pulso.,Tôi sẽ đặt cái này lên ngón tay để kiểm tra mạch đập.,Je place ceci sur votre doigt pour vérifier l'oxymétrie de pouls.,이것을 손가락 위에 놓고 맥박을 확인하겠습니다.,የልብ ትርታዎን ለማየት ይህን ጣትዎ ላይ እያደረኩ ነው።,​အောက်စီဂျင်ဓာတ်ကိုတိုင်းဖို့ ဒါကို လက်ညှိုးထိပ်မှာ တပ်ပါမယ်။,أنا أضع هذا على الإصبع للتحقق من التأكسج النبضي.,我会把它放在手指上，测量脉搏血氧饱和度。
doing_ekg,I am going to do an EKG.,Le voy a hacer un electrocardiograma (EKG).,Vou fazer um eletrocardiograma.,Tôi sẽ đo EKG.,Je vais faire un électrocardiogramme.,심전도 검사(EKG)를 하겠습니다.,EKG ልሰራልዎት ነው።,အီးစီဂျီ တိုင်းပါမယ်။,سأجري تخطيط كهربية القلب (إيكو).,我将为您进行心电图检查。
please_lie_still,Please lie very still.,Recuéstese y no se mueva.,Não se mexa por favor.,Vui lòng nằm yên tại chỗ.,Restez allongé(e) sans bouger.,움직이지 말고 가만히 누워 계십시오.,እባክዎ ሳይንቀሳቀሱ ይተኙ።,ငြိမ်ငြိမ်လေး လဲလျောင်းပေးပါ။,يُرجى الاستلقاء بثبات شديد.,请躺着不要动。
breathe_normally_and_dont_move,Breathe normally but try not to move around.,Respire normalmente pero no trate de moverse.,Respire normalmente mas tente não se movimentar.,Thở bình thường nhưng cố gắng không nhúc nhích cử động.,Respirez normalement mais essayez de ne pas bouger.,호흡은 정상적으로 하시고 되도록 움직이지 마십시오.,የተለመደ አተነፋፈስ ይተንፍሱነገር ግን ላለመንቀሳቀስ ይሞክሩ።,ပုံမှန်အသက်ရှူပြီး မလှုပ်ပါနှင့်။,تنفس بشكل طبيعي ولكن حاول ألا تتحرك.,请正常呼吸，但尽量不要动。
nurse_will_be_in_shortly,The nurse will be in shortly.,El enfermero vendrá muy pronto.,A enfermeira chegará em breve.,Y tá sẽ đến ngay.,L'infirmier ou l'infirmière va bientôt arriver.,간호사가 곧 올 것입니다.,ነርሷ በአጭር ጊዜ ውስጥ ትገባለች።,သူနာပြု မကြာမီ လာပါမယ်။,ستصل الممرضة بعد قليل,护士很快就会过来。
doctor_will_be_in_shortly,The doctor will be in shortly.,El médico vendrá muy pronto.,O médico chegará em breve.,Bác sĩ sẽ đến ngay.,Le médecin va bientôt arriver.,의사가 곧 올 것입니다.,ሐኪሙ በአጭር ጊዜ ውስጥ ይገባል።,ဆရာဝန် မကြာမီ လာပါမယ်။,سيصل الطبيب بعد قليل,医生很快就会过来。
taking_you_to_room_for_echo,I am taking you to the room where they will do an echo.,Lo estoy llevando a la sala donde le van a hacer un ecocardiograma.,Vou levar você para a sala de ultrassonografia.,Tôi sẽ đưa quý vị đến phòng nơi chụp vang tim.,Je vous emmène dans la salle où l'on va faire l'échographie.,초음파 검사실로 모시겠습니다.,ኤኮ ወደሚሰሩበት ክፍል እየወሰድኮት ነው።,အက်ခိုးလို့ခေါ်တဲ့ တန်ပြန်အသံကို တိုင်းမယ့် အခန်းထဲ သွားကြပါမယ်။,سآخذك إلى الغرفة حيث سيقومون بعمل إيكو.,我将带您前往超声心动图检查室。
want_to_watch_movie_during_echo,Would you like to watch a movie during your echo?,¿Quiere ver una película mientras le hago el ecocardiograma?,Quer assistir a um filme durante a ultrassonografia?,Quý vị có muốn xem phim trong khi đang được chụp vang tim không?,Voulez-vous regarder un film pendant votre échographie?,초음파 검사를 하는 동안 영화를 보시겠습니까?,ኤኮ በሚሰራበት ጊዜ ፊልም ማየት ይፈልጋሉ?,အက်ခိုးတိုင်းနေတဲ့အချိန်မှာ သင် ရုပ်ရှင်ကြည့်ချင်သလား။,هل ترغب في مشاهدة فيلم في أثناء إجراء الإيكو؟,您是否想在超声心动图检查期间看看电影？
