Variable Names,English,Spanish,Portuguese (Brazilian),Vietnamese,French,Korean,Amharic,Burmese,Arabic,Mandarin Chinese
back_to_room_after_echo,They will bring you back to your room after the echo.,Lo volverán a traer a su habitación después del ecocardiograma.,Vão levar você de volta ao quarto após a ultrassonografia.,Họ sẽ đưa quý vị trở lại phòng sau khi chụp vang tim.,On vous ramènera dans votre chambre après votre échographie.,초음파 검사가 끝나면 직원이 귀하의 병실로 데려다 줄 것입니다.,ከኤኮ በኋላ ወደ ክፍልዎ መልሰው ይወስዱዎታል።,အက်ခိုးတိုင်းပြီးရင် သင့်အခန်းဆီ ပြန်ခေါ်သွားပေးပါမယ်။,سوف يعيدونك إلى غرفتك بعد إجراء الإيكو.,超声心动图检查结束后，他们会带您回到您的房间。
doctor_coming_to_discuss_echo,The doctor will be in soon to discuss the results if the ECHO,El médico vendrá pronto para conversar sobre los resultados del ecocardiograma.,O médico virá em breve para falar dos resultados da ultrassonografia.,Bác sĩ sẽ đến ngay để thảo luận về kết quả chụp vang tim nếu ECHO,Le médecin va bientôt arriver pour discuter des résultats de votre échographie.,초음파 검사 결과가 나오면 의사가 곧 검사 결과를 상의드릴 것입니다,ሐኪሙ የ ECHO ውጤቶችን ለመወያየት በቅርቡ ይመጣል,အက်ခိုး အဖြေကိုဆွေးနွေးဖို့ ဆရာဝန် မကြာမီ လာပါမယ်။,سيأتي الطبيب قريبًا لمناقشة نتائج فحص الإيكو,医生很快会过来和您讨论超声心动图检查结果
taking_pictures_of_heart,We are taking pictures of your heart.,Vamos a tomar fotos de su corazón.,Estamos tirando fotos do seu coração.,Chúng tôi đang chụp hình tim của quý vị.,Nous prenons des photos de votre cœur.,귀하의 심장 사진을 찍고 있습니다.,የልብዎን ምስሎች እየወሰድን ነው።,သင့်နှလုံးကို ဓာတ်ပုံရိုက်ပါမယ်။,نحن نلتقط صورًا لقلبك.,我们正在进行心脏拍片。
this_will_not_hurt,This will not hurt.,No le va a doler.,Não vai doer.,Việc này sẽ không gây đau.,Cela ne vous fera pas mal.,아프지 않을 것입니다.,ይህ አያምም።,မနာပါဘူး။,لن تشعر بأي ألم.,您不会有痛感。
lay_down_on_left,Lay down on the bed on your left side.,Recuéstese en la cama sobre el lado derecho.,Deite-se na cama virando para o seu lado esquerdo.,Nằm xuống giường và nằm nghiêng về bên trái.,Allongez-vous sur le lit sur votre côté gauche.,침대에 왼쪽으로 누우십시오.,አልጋው ላይ በግራ ጎንዎ ይተኙ።,ကုတင်ပေါ် ဘယ်ဘက်စောင်းပြီး လဲလျောင်းအိပ်ပေးပါ။,استلق على السرير على جانبك الأيسر.,请躺在床上，左侧卧。
lie_flat_on_back,Lie flat on your back.,Recuéstese estirado y boca arriba.,Deite-se de costas.,Nằm ngửa.,Allongez-vous sur le dos.,등을 바닥에 대고 반듯이 누우십시오.,በጀርባዎ ቀጥ ብለው ይተኙ።,ပက်လက်လှန် အိပ်ပေးပါ။,استلق ممددًا على ظهرك.,请平躺在床上。
lift_chin_up,Tilt/lift your chin up.,Incline y levante la barbilla.,Incline a cabeça levantando o queixo para cima. ,Ngả/nâng cằm lên.,Relevez le menton.,턱을 위로 기울이십시오/들어올리십시오.,ያዘንብሉ/አገጭዎን ወደ ላይ ቀና ያርጉ።,​မေးစေ့ကို မော့ပေးပါ။,قم بإمالة أو رفع ذقنك لأعلى.,请倾斜/抬起下巴。
lift_under_shoulders_and_tilt_head_back,Lift under the baby's shoulders and tilt the head back.,Levante los hombros del bebé e inclínele la cabeza hacia atrás.,Levante sob os ombros do bebê e incline a cabeça para trás.,Nâng dưới vai em bé và ngả đầu về phía sau.,Soulevez les épaules de bébé et inclinez sa tête vers l'arrière.,아기의 어깨 아래로 들어 올리고 머리를 뒤로 젖히게 하십시오.,በህጻኑ ትከሻዎች ስር ቀና ያርጉ እና ጭንቅላቱን ወደ ኋላ ያዘንብሉ።,ကလေးငယ်ရဲ့ ပုခုံးကိုကိုင်မပြီး ခေါင်းကို နောက်ဘက်နည်းနည်းစောင်းပေးပါ။,ارفعي الطفل من أسفل كتفيه مع إمالة رأسه للخلف,请从肩部下方将宝宝抬起，并使其头部后仰。
breathe_and_hold,Take in a deep breath and hold it  ,Inhale profundamente y mantenga la respiración.,Respire fundo e segure a respiração  ,Hít một hơi thật sâu và nín thở,Inspirez profondément et retenez votre souffle.,심호흡을 하고 참으십시오,በጥልቀት ወደ ውስጥ በመተንፈስ አየር ሳያስወጡ ይያዙት,အသက် ပြင်းပြင်းရှူပြီး အောင့်ထားပါ။,خذ نفسًا عميقًا واحبسه.,请深吸一口气，然后屏住呼吸
you_can_breathe_now,You can breathe now.,Ya puede respirar.,Já pode respirar.,Bây giờ quý vị có thể thở lại được rồi.,Vous pouvez maintenant respirer.,이제 숨을 쉬셔도 됩니다.,አሁን መተንፈስ ይችላሉ።,ပုံမှန် အသက်ရှူလို့ရပါပြီ။,يمكنك إخراجه الآن.,您现在可以正常呼吸了。
lift_your_arm_up_high,Lift your arm up high under your head please.,Levante el brazo hasta debajo de la cabeza.,Levante o braço bem alto sob sua cabeça por favor.,Vui lòng nâng cánh tay lên cao và đặt dưới đầu của quý vị.,Levez le bras sous la tête s'il vous plaît.,머리 아래로 팔을 높이 들어주십시오.,እባክዎ እጅዎ ከጭንቅላትዎ ስር ወደ ላይ ከፍ ያድርጉት።,လက်မောင်းကို ခေါင်းအောက်လောက်အထိ မြောက်ပေးပါ။,ارفع ذراعك للأعلى وضعه تحت رأسك من فضلك.,请将胳膊抬高放在头下。
bend_your_knees,Bend your knees please.,Doble las rodillas.,Dobre os joelhos por favor.,Vui lòng gập hai đầu gối.,Pliez les genoux s'il vous plaît.,무릎을 굽히십시오.,እባክዎ ጉልበትዎን ይጠፉ።,ဒူးကွေးပေးပါ။,اثنِ ركبتيك من فضلك.,请弯曲膝盖。
roll_on_your_side,Roll on your side more towards me.,Voltéese de lado más hacia mí.,Vire-se de lado mais para perto de mim.,Hãy lăn nghiêng thêm nữa về phía tôi.,Tournez-vous sur le côté plus près de moi.,제 쪽으로 좀 더 돌아누우십시오.,በጎንዎ ወደ እኔ የበለጠ ይጠጉ።,ကျွန်ုပ်ဘက်လှည့်ပြီး နည်းနည်းကပ်ပေးပါ။,استدر على جانبك أكثر نحوي.,请往我这边侧身一些。
help_me_if_baby_is_fussy,I will need your help if the baby gets fussy.,Voy a necesitar su ayuda si el bebé se pone inquieto.,Vou precisar da sua ajuda se o bebê ficar agitado.,Tôi sẽ cần quý vị giúp nếu em bé quấy khóc.,J'aurai besoin de votre aide si votre bébé manifeste de la nervosité.,아기가 보채면 보호자분의 도움이 필요합니다.,ህጻኑ ካስቸገረ የእርስዎን እርዳታ እፈልጋለሁ።,တကယ်လို့ ကလေးက အင်တင်တင်လုပ်နေရင် သင့်ရဲ့အကူအညီ လိုအပ်ပါမယ်။,سأحتاج إلى مساعدتك إذا أصبح الطفل متهيجًا.,如果宝宝开始哭闹，我将需要您的帮助。
feed_baby_I_will_scan,You can feed the baby while I scan.,Puede alimentar al bebé mientras hago la exploración (scan).,Pode alimentar o bebê enquanto eu faço o exame.,Quý vị có thể cho em bé ăn trong khi tôi chụp scan.,Vous pouvez nourrir votre bébé pendant que je fais l'examen.,제가 스캔하는 동안 아기에게 젖을 주실 수 있습니다.,በምቃኝበት ጊዜ ህጻኑን መመገብ ይችላሉ።,ကျွန်ုပ် လုပ်နေစဥ်မှာ သင် ကလေးကို နို့တိုက်နေနိုင်ပါတယ်။,يمكنك إطعام الطفل في أثناء إجراء الفحص.,当我进行扫描时，您可以给宝宝喂食。
can_have_pacifier,The baby can have a pacifier.,Le puede dar su chupón al bebé.,O bebê pode chupar a chupeta.,Có thể cho em bé ngậm vú giả.,Votre bébé peut avoir sa tétine.,아기에게 고무 젖꼭지를 물려도 됩니다.,ህጻኑ የእንጀራ እናት መጥባት ይችላል።,ကလေး နို့သီးခေါင်း စို့နေနိုင်ပါတယ်။,يمكن أن يحصل الطفل على لهاية.,宝宝可以含着安抚奶嘴。
hold_baby_i_will_scan,Please hold the baby while I scan.,Cargue al al bebé mientras hago la exploración (scan).,Segure o bebê enquanto faço o exame.,Vui lòng bồng em bé trong khi tôi chụp scan.,S'il vous plaît tenez votre bébé pendant que je fais l'examen.,제가 스캔하는 동안 아기를 잡고 계십시오.,እኔ በምቃኝበት ጊዜ እባክዎ ህጻኑን ይያዙት።,ကျွန်ုပ် လုပ်နေစဥ်မှာ ကလေးကို ကိုင်ထားပေးပါ။,يُرجى إمساك الطفل بينما أجري الفحص.,请在我进行扫描时抱住宝宝。
doctor_soon,The doctor will be in soon.,El médico vendrá pronto.,O médico chegará em breve.,Bác sĩ sẽ đến ngay.,Le médecin va bientôt arriver.,의사가 곧 올 것입니다.,ዶክትሩ በቅርቡ ይመጣል።,ဆရာဝန် မကြာမီ လာပါမယ်။,سيصل الطبيب بعد قليل.,医生很快就会过来。
do_you_have_ride_home,Do you have a ride home?,¿Tiene quién los lleve a casa?,Tem uma carona para casa?,Có ai chở quý vị về nhà không?,Avez-vous un moyen de transport pour rentrer chez vous?,집에 가실 교통편이 있습니까?,ወደ ቤት የሚወስድዎት መኪና አለ?,အိမ်ပြန်ဖို့ ကားရှိလား။,هل لديك وسيلة لإيصالك إلى المنزل؟,您怎么回家呢？有车载您回去吗？
will_call_medicaid_transportation,I will call Medicaid transportation.,Llamaré al servicio de transporte de Medicaid.,Vou ligar para o transporte do Medicaid.,Tôi sẽ gọi dịch vụ chuyên chở của Medicaid.,Je vais appeler le service de transport agréé Medicaid.,메디케이드(Medicaid) 교통편에 전화하겠습니다.,የ Medicaid መጓጓዣ እጠራለሁ።,Medicaid ကားနဲ့ပို့ပေးဖို့ ခေါ်ပေးပါမယ်။,سأتصل بخدمة النقل من Medicaid.,我可以为您联系医保内的交通服务。
medicaid_transportation_on_the_way,Medicaid transportation is on the way.,El servicio de transporte de Medicaid está en camino.,O transporte do Medicaid está a caminho.,Xe chuyên chở Medicaid đang trên đường đến.,Le service de transport Medicaid est en route.,메디케이드(Medicaid) 교통편이 오는 중입니다.,የ Medicaid መጓጓዣ እየመጣ ነው።,Medicaid ကားနဲ့ပို့ပေးဖို့ လာနေပါပြီ။,خدمة النقل من Medicaid في الطريق.,交通服务车正在过来的路上。
do_you_have_money_for_food,Do you have money for food while your child is in the hospital?,¿Tiene dinero para comprar de comer mientras su niño está en el hospital?,Tem dinheiro para comprar comida enquanto a criança está no hospital?,Quý vị có tiền mua thức ăn trong thời gian em bé nằm bệnh viện không?,Avez-vous suffisamment d'argent pour acheter de la nourriture pendant que votre enfant est à l'hôpital ?,아이가 병원에 ​​있는 동안 음식을 드실 돈이 있으십니까?,ልጅዎ ሆስፒታል ውስጥ በሚሆንበት ጊዜ ለምግብ የሚሆን ገንዘብ አልዎት?,သင့်ကလေး ဆေးရုံမှာရှိနေစဥ်မှာ အစာစားဖို့ ငွေရှိလား။,هل لديك المال لشراء الطعام في أثناء وجود طفلك في المستشفى؟,在您孩子住院期间，您有钱吃饭吗？
please_fill_out_this_form,Please fill out this form.,Llene este formulario.,Preencha este formulário por favor.,Vui lòng điền mẫu đơn này.,Veuillez remplir ce formulaire.,이 양식을 기재해 주십시오.,እባክዎ ይህን ቅጽ ይሙሉ።,ဒီပုံစံကို ဖြည့်ပေးပါ။,يُرجى استكمال هذا النموذج.,请填写此表格。
are_you_able_to_obtain_medication,Are you able to obtain the medications your child needs?,¿Puede comprar los medicamentos que necesita su niño?,Tem condições de obter os medicamentos de que a criança precisa?,Quý vị có khả năng có được những thuốc em bé cần không?,Êtes-vous en mesure d'obtenir les médicaments dont votre enfant a besoin ?,아이에게 필요한 약을 구하실 수 있습니까?,ለልጅዎ የሚያስፈልገውን መድሃኒቶች ማግኘት ይችላሉ?,သင့်ကလေး လိုအပ်တဲ့ ဆေးတွေကို ရယူနိုင်သလား။,هل تستطيعين الحصول على الأدوية التي يحتاجها طفلك؟,您是否能够获得孩子需要的药物？
we_are_here_to_help_you,We are here to help and support you.,Estamos aquí para ayudarlo y darle apoyo.,Estamos aqui para ajudar e dar apoio.,Chúng tôi luôn sẵn lòng giúp đỡ và hỗ trợ quý vị.,Nous sommes là pour vous aider et vous accompagner.,저희가 귀하를 돕고 지원할 수 있습니다.,እርስዎን ለመርዳት እና ለመደገፍ በዚህ አለን።,သင့်ကို ကျွန်ုပ်တို့ ကူညီပံ့ပိုးပေးနိုင်ပါတယ်။,نحن هنا لمساعدتك ودعمك.,我们能够为您提供帮助和支持。
resources_to_assist_with_care,These are resources to assist with care when you are discharged.,Estos son los recursos que lo ayudarán con el cuidado de su niño al dársele de alta.,Estes são recursos para ajudar nos cuidados quando receber alta.,Đây là những nguồn trợ giúp để giúp chăm sóc khi quý vị xuất viện.,Voici des ressources qui vous aideront à prendre soin de votre enfant à sa sortie de l'hôpital.,이러한 자원들은 퇴원 시 도움이 되는 것들입니다.,እነዚህ ከሆስፒታል ሲወጡ እንክብካቤ ላይ የሚያግዙዎት ቁሳቁሶች ናቸው።,​ဆေးရုံဆင်းတဲ့အခါ ကူညီစောင့်ရှောက်ပေးဖို့ ရင်းမြစ်တွေရှိပါတယ်။,هذه موارد للمساعدة في الرعاية عند خروجك من المستشفى.,在您出院之后，这些资源能够帮助您进行护理。
list_of_lowcost_clinics,Here is a listing of pediatricians and low-cost clinics.,Esta es una lista de pediatras y clínicas de bajo costo.,Aqui está uma lista de pediatras e clínicas de baixo custo.,Dưới đây là danh sách các bác sĩ nhi khoa và y viện giá phải chăng. ,Voici une liste de pédiatres et de cliniques à tarif modéré.,다음은 소아과 의사들과 저렴한 진료소 목록입니다.,የሕጻናት ህክምና ስፔሻሊስቶች እና ዝቅተኛ ወጪ የሚጠይቁ ክሊኒኮች ዝርዝር አዝህ ነው።,ကလေးအထူးကုဆရာဝန်တွေ စာရင်းတစ်ခုနဲ့ စျေးနှုန်းချိုသာတဲ့ ဆေးခန်းတွေစာရင်း ဒီမှာပါ။,فيما يأتي قائمة بأطباء الأطفال والعيادات منخفضة التكلفة.,这是儿科医生和经济型诊所的名单列表。
do_you_have_insurance,Do you have insurance?,¿Tiene seguro?,Você tem plano de saúde?,Quý vị có bảo hiểm không?,Avez-vous une assurance maladie?,보험이 있으십니까?,መድህን አልዎት?,အာမခံ လုပ်ထားသလား။,هل لديك تأمين؟,您是否有保险？
does_the_patient_have_insurance,Does the patient have insurance?,¿Tiene seguro el paciente?,O paciente tem plano de saúde?,Bệnh nhân có bảo hiểm không?,Le patient ou la patiente a-t-il ou elle une assurance maladie?,환자에게 보험이 있습니까?,ታካሚው መድህን አለው?,လူနာမှာ အာမခံ ရှိသလား။,هل المريض لديه تأمين؟,患者是否有保险？
hospital_financial_counselor,Here is the phone number for the hospital financial counselor.,Este es el número de teléfono del asesor financiero del hospital.,Aqui está o telefone da consultoria financeira do hospital.,Đây là số điện thoại của cố vấn tài chánh của bệnh viện.,Voici le numéro de téléphone du conseiller financier de l'hôpital.,병원 재정 상담사의 전화번호는 다음과 같습니다.,የሆስፒታሉ የፋይናንስ አማካሪ ስልክ ቁጥር እዚህ ጋር አለ።,​ဆေးရုံ ငွေကြေးအကြံပေးသူရဲ့ ဖုန်းနံပါတ် ဒီမှာပါ။,هذا رقم هاتف المستشار المالي للمستشفى.,这是医院财务顾问的电话号码。
do_you_need_interpreter,Do you need an interpreter?,¿Necesita un intérprete?,Precisa de intérprete?,Quý vị có cần thông dịch viên không? ,Avez-vous besoin d'un interprète?,통역사가 필요하십니까?,አስተርጓሚ ይፈልጋሉ?,စကားပြန် လိုအပ်သလား။,هل تحتاجين إلى مترجم؟,您是否需要口译员？
would_you_like_an_interpreter,Would you like me to call an interpreter?,¿Quisiera que llame a un intérprete?,Quer que eu chame um intérprete?,Quý vị có muốn tôi gọi thông dịch viên không?,Voulez-vous que j'appelle un interprète?,제가 전화로 통역사를 부를까요?,ወደ አስተርጓሚ እንድደውል ይፈልጋሉ?,စကားပြန် ခေါ်ပေးချင်ပါသလား။,هل تودين أن أطلب لك مترجمًا؟,您是否需要我呼叫口译员？
has_doctor_called_with_updates,Has the doctor called you today with an update on your baby?,¿Le ha llamado hoy el médico para darle una actualización sobre su bebé?,O médico ligou hoje para saber como está o bebê?,Hôm nay bác sĩ có gọi cho quý vị để thông báo tin tức về bé không?,Le médecin vous a-t-il appelé aujourd'hui pour vous donner des nouvelles de votre bébé ?,오늘 의사가 아기에 관한 소식을 알려줬습니까?,ሐኪሙ ስለ ልጅዎ አዲስ ነገር ይዞ ዛሬ ደውሎልዎታል?,သင့်ကလေးငယ်နဲ့ပတ်သက်ပြီးပြောဆိုဖို့ ဒီနေ့ ဆရာဝန် ဖုန်းခေါ်ပါသလား။,هل اتصل بكِ الطبيب اليوم ليخبرك بآخر المستجدات بشأن طفلك؟,今天医生有没有打电话告知您宝宝的最新情况？
do_you_have_questions,Do you have any questions?,¿Tiene alguna pregunta?,Alguma pergunta?,Quý vị có thắc mắc gì không?,Avez-vous des questions?,질문이 있으십니까?,ማንኛውም ጥያቄዎች አልዎት?,​မေးစရာ ရှိပါသလား။,هل تودين طرح أي أسئلة؟,您是否有任何疑问？
speak_to_lactation_consultant,Do you want to speak with a lactation consultant (or nurse)?,¿Quiere hablar con un consejero (o enfermero) especializado en lactancia?,Quer falar com a consultoria de lactação (ou a enfermagem)?,Quý vị có muốn nói chuyện với chuyên viên cố vấn về nuôi con bằng sữa mẹ (hoặc y tá) không?,Voulez-vous parler à une consultante en lactation (ou à une infirmière) ?,수유 상담사 또는 간호사와 얘기하고 싶으십니까?,የጡት ወተት አማካሪ (ወይም ነርስ) ጋር ማውራት ይፈልጋሉ?,နို့ရည်အတတ်ပညာရှင်နဲ့ စကားပြောချင်သလား။,هل تودين التحدث مع استشاري الرضاعة (أو الممرضة)؟,您是否想要与哺乳顾问（或护士）交谈？
help_with_oral_care,Do you want to help with oral care?,¿Quiere ayudarnos con el cuidado bucal?,Quer ajudar com os cuidados bucais?,Quý vị có muốn giúp đỡ về chăm sóc răng miệng không?,Voulez-vous aider à faire les soins de la bouche?,구강 관리를 도와주시겠습니까?,የአፍ እንክብካቤ ላይ እርዳታ ይፈልጋሉ?,သွားကျန်းမာရေးနဲ့ပတ်သက်ပြီး အကူအညီလိုသလား။,هل تريدين المساعدة في العناية بالفم؟,您是否想要帮忙进行口腔护理？
want_to_change_diaper,Do you want to help change the diaper?,¿Quiere ayudarnos a cambiar el pañal?,Quer ajudar a trocar a fralda?,Quý vị có muốn giúp đỡ về việc thay tã không?,Voulez-vous aider à changer la couche?,기저기 교체를 도와주시겠습니까?,የዳይፐር አቀያየር ላይ እርዳታ ይፈልጋሉ?,​သေးခံ လဲဖို့ အကူအညီလိုသလား။,هل تريدين المساعدة في تغيير الحفاضة؟,您是否想要帮忙换尿布？
want_to_take_babys_temperature,Do you want to take the baby's temperature?,¿Quiere tomarle la temperatura a su bebé?,Quer tirar a temperatura do bebê?,Quý vị có muốn đo nhiệt độ của em bé không? ,Voulez-vous prendre la température de votre bébé?,아기의 체온 재기를 원하십니까?,የህጻኑን ሙቀት መለካት ይፈልጋሉ?,ကလေးကို အဖျားတိုင်းကြည့်ချင်သလား။,هل تريدين قياس درجة حرارة الطفل؟,您是否想要给宝宝量体温？
want_to_hold_baby,Do you want to hold your baby?,¿Quiere cargar a su bebé?,Quer segurar o bebê?,Quý vị có muốn bồng em bé không?,Voulez-vous tenir votre bébé dans vos bras?,아이를 안고 싶으십니까?,ልጅዎን መያዝ ይፈልጋሉ?,သင့်ကလေးကို ကိုင်ချင်သလား။,هل ترغبين في حمل طفلك؟,您是否想要抱抱您的宝宝？
hold_baby_skin_to_skin,Do you want to hold your baby skin to skin?,¿Quiere cargar a su bebé para que sienta su piel en contacto con la suya?,Quer segurar o bebê fazendo contato com a pele?,Quý vị có muốn bồng con theo kiểu da áp da không?,Voulez-vous tenir votre bébé peau contre peau?,서로 피부가 닿도록 아이를 안고 싶으십니까?,በአካል ለአካል ንክኪ ልጅዎን መያዝ ይፈልጋሉ?,သင်ကလေးကို အသားချင်းထိပြီးနေချင်သလား။,هل ترغبين في حمل طفلك ملامسًا لجلدك؟,您是否想要肌肤相亲地抱抱您的宝宝？
need_more_milk_bottles,Do you need more bottles for your milk for home?,¿Necesita más biberones para su leche en casa?,Precisa de mais mamadeiras para o leite em casa?,Quý vị có cần thêm bình sữa để dùng ở nhà không?,Avez-vous besoin de plus de biberons pour votre lait à la maison?,모유를 짜서 집에 가져가기 위해 병이 더 필요하십니까?,በቤትዎ ለወተት የሚሆኑ ብዙ ጠርሙሶች ይፈልጋሉ?,အိမ်အတွက် နို့ပုလင်း များများ လိုချင်ပါသလား။,هل تحتاجين إلى المزيد من زجاجات الحليب للمنزل؟,您是否需要带更多的瓶子装您的母乳回家？
baby_is_sleeping_ill_come_later,The baby is sleeping I'll come back later,El bebé está durmiendo. Volveré más tarde.,O bebê está dormindo. Volto mais tarde.,Em bé đang ngủ tôi sẽ trở lại sau,Votre bébé dort je reviendrai plus tard.,아기가 자고 있네요. 제가 이따가 다시 오겠습니다,ህጻኑ ተኝቷል በኋላ ተመልሼ እመጣለሁ,ကလေးအိပ်နေတယ်၊ နောက်မှပြန်လာပါမယ်။,الطفل نائم سأعود لاحقا,宝宝正在睡觉，我待会儿再过来
